{
  "$schema": "https://json-schema.org/draft/2020-12/schema",
  "title": "Issue-guided executable reward spec",
  "type": "object",
  "additionalProperties": false,
  "required": ["version", "admission", "root", "target"],
  "properties": {
    "version": {"type": "string", "const": "reward-spec-v1"},
    "admission": {"$ref": "#/$defs/contract"},
    "root": {"$ref": "#/$defs/contract"},
    "target": {"$ref": "#/$defs/contract"}
  },
  "$defs": {
    "contract": {
      "type": "object",
      "additionalProperties": false,
      "required": ["claim", "support", "observability", "events", "predicate"],
      "properties": {
        "claim": {"type": "string"},
        "support": {
          "type": "object",
          "additionalProperties": false,
          "required": ["status", "issue_evidence"],
          "properties": {
            "status": {
              "type": "string",
              "enum": [
                "issue_explicit",
                "source_disambiguated",
                "ambiguous",
                "unsupported"
              ]
            },
            "issue_evidence": {
              "type": "array",
              "items": {"type": "string"}
            }
          }
        },
        "observability": {
          "type": "string",
          "enum": ["direct", "derived", "proxy", "unresolved"]
        },
        "events": {
          "type": "array",
          "maxItems": 3,
          "items": {"$ref": "#/$defs/event"}
        },
        "predicate": {"type": "string"}
      }
    },
    "event": {
      "type": "object",
      "additionalProperties": false,
      "required": ["id", "at", "capture"],
      "properties": {
        "id": {
          "type": "string",
          "pattern": "^[a-z][a-z0-9_]*$"
        },
        "at": {"type": "string"},
        "capture": {
          "type": "array",
          "items": {"$ref": "#/$defs/capture"}
        }
      }
    },
    "capture": {
      "type": "object",
      "additionalProperties": false,
      "required": ["name", "expression"],
      "properties": {
        "name": {
          "type": "string",
          "pattern": "^[a-z][a-z0-9_]*$"
        },
        "expression": {"type": "string"}
      }
    }
  }
}
