{"version":"reward-spec-v1","admission":{"claim":"An mbstring regex-facing entry path accepts a non-empty pattern and forwards it into Oniguruma compilation through `php_mbregex_compile_pattern()`.","support":{"status":"ambiguous","issue_evidence":["Fuzz Target: php-fuzz-mbstring","Project: php"]},"observability":"proxy","events":[{"id":"compile_onig","at":"php-src/ext/mbstring/php_mbregex.c:php_mbregex_compile_pattern:466","capture":[{"name":"pattern","expression":"pattern"},{"name":"patlen","expression":"patlen"},{"name":"syntax","expression":"syntax"}]}],"predicate":"compile_onig.hit && compile_onig.capture.patlen > 0"},"root":{"claim":"During regex compilation, `tune_quant()` reaches an empty-repeat analysis handoff where a zero-length quantifier body is passed to `quantifiers_memory_node_info()` as the subtree later involved in the reported UAF read.","support":{"status":"ambiguous","issue_evidence":["Crash Type: Heap-use-after-free READ 4","Crash State: quantifiers_memory_node_info tune_quant tune_tree"]},"observability":"proxy","events":[{"id":"empty_repeat_analysis","at":"php-src/oniguruma/src/regcomp.c:tune_quant:5458","capture":[{"name":"body","expression":"body"},{"name":"upper","expression":"qn->upper"},{"name":"min_len","expression":"node_min_byte_len(body, env)"}]}],"predicate":"empty_repeat_analysis.hit && empty_repeat_analysis.capture.body != 0 && empty_repeat_analysis.capture.min_len == 0 && empty_repeat_analysis.capture.upper != 0"},"target":{"claim":"The same subtree pointer handed off by `tune_quant()` is later consumed in `quantifiers_memory_node_info()` when that function dereferences the node to inspect its type and recurse through children.","support":{"status":"source_disambiguated","issue_evidence":["Crash Type: Heap-use-after-free READ 4","Crash State: quantifiers_memory_node_info tune_quant tune_tree"]},"observability":"direct","events":[{"id":"uaf_read","at":"php-src/oniguruma/src/regcomp.c:quantifiers_memory_node_info:4898","capture":[{"name":"node","expression":"node"}]}],"predicate":"uaf_read.hit && empty_repeat_analysis.hit && uaf_read.time > empty_repeat_analysis.time && uaf_read.capture.node == empty_repeat_analysis.capture.body"}}