{"version":"reward-spec-v1","admission":{"claim":"The public issue does not identify any concrete PROJ.4 entrypoint, accepted argument form, or issue-relevant internal object closely enough to bind a responsible Admission contract from source inspection alone.","support":{"status":"unsupported","issue_evidence":[]},"observability":"unresolved","events":[],"predicate":""},"root":{"claim":"The public issue and available source do not uniquely bind a specific unchecked index state that establishes the vulnerable condition before an array access.","support":{"status":"unsupported","issue_evidence":[]},"observability":"unresolved","events":[],"predicate":""},"target":{"claim":"The public issue and available source do not uniquely identify a later dangerous array operation that consumes the same unchecked index witness.","support":{"status":"unsupported","issue_evidence":[]},"observability":"unresolved","events":[],"predicate":""}}