{"version":"reward-spec-v1","admission":{"claim":"A FLAC frame residual partition is accepted by the stream decoder and handed to `FLAC__bitreader_read_rice_signed_block` as a live bitreader request with at least one sample to decode.","support":{"status":"source_disambiguated","issue_evidence":["An out-of-bounds read occurs in libFLAC/bitreader.c."]},"observability":"direct","events":[{"id":"admit_call","at":"flac/src/libFLAC/stream_decoder.c:read_residual_partitioned_rice_:2773","capture":[{"name":"br","expression":"decoder->private_->input"},{"name":"u","expression":"u"},{"name":"rice_parameter","expression":"rice_parameter"}]}],"predicate":"admit_call.hit && admit_call.capture.br != 0 && admit_call.capture.u > 0 && admit_call.capture.rice_parameter < 32"},"root":{"claim":"`FLAC__bitreader_read_rice_signed_block` re-enters its fast-path state with more values still pending but with `cwords == words` and no partial tail bytes, establishing an invalid next-word witness.","support":{"status":"source_disambiguated","issue_evidence":["An out-of-bounds read occurs in libFLAC/bitreader.c."]},"observability":"direct","events":[{"id":"root_state","at":"flac/src/libFLAC/bitreader.c:FLAC__bitreader_read_rice_signed_block:864","capture":[{"name":"cwords","expression":"cwords"},{"name":"words","expression":"words"},{"name":"bytes","expression":"br->bytes"},{"name":"has_more","expression":"val < end"}]}],"predicate":"root_state.hit && root_state.capture.cwords == root_state.capture.words && root_state.capture.bytes == 0 && root_state.capture.has_more"},"target":{"claim":"The same invalid `cwords == words` witness is consumed by the later fast-path fetch `b = br->buffer[cwords] << br->consumed_bits`, producing the out-of-bounds read.","support":{"status":"source_disambiguated","issue_evidence":["An out-of-bounds read occurs in libFLAC/bitreader.c."]},"observability":"direct","events":[{"id":"oob_fetch","at":"flac/src/libFLAC/bitreader.c:FLAC__bitreader_read_rice_signed_block:867","capture":[{"name":"index","expression":"cwords"},{"name":"words","expression":"words"}]}],"predicate":"root_state.hit && oob_fetch.hit && oob_fetch.time > root_state.time && root_state.capture.cwords == root_state.capture.words && root_state.capture.bytes == 0 && root_state.capture.has_more && oob_fetch.capture.index == root_state.capture.cwords && oob_fetch.capture.words == root_state.capture.words"}}