{"version":"reward-spec-v1","admission":{"claim":"A length-delimited Markdown buffer matching the reported c-string-style sample, including embedded NUL bytes, is accepted through `md_parse()` and stored into the parser context as the internal input object.","support":{"status":"source_disambiguated","issue_evidence":["A buffer overflow occurs on input in c-string format such as:"," A | rong__ ___strong \\u0000\\u0000\\u0000\\u0000\\u0000\\u0000\\a\\u0000\\u0000\\u0000\\u0000"]},"observability":"direct","events":[{"id":"admission_ctx","at":"md4c/src/md4c.c:md_parse:6320","capture":[{"name":"arg_text","expression":"text"},{"name":"arg_size","expression":"size"},{"name":"ctx_text","expression":"ctx.text"},{"name":"ctx_size","expression":"ctx.size"}]}],"predicate":"admission_ctx.hit && admission_ctx.capture.arg_size > 0 && admission_ctx.capture.arg_text == admission_ctx.capture.ctx_text && admission_ctx.capture.arg_size == admission_ctx.capture.ctx_size"},"root":{"claim":"A specific internal overflow-enabling parser state for the reported input is established.","support":{"status":"unsupported","issue_evidence":[]},"observability":"unresolved","events":[],"predicate":""},"target":{"claim":"A later dangerous buffer operation consumes the same overflow-enabling witness from Root.","support":{"status":"unsupported","issue_evidence":[]},"observability":"unresolved","events":[],"predicate":""}}